title,status,tipo,prioridade,especialidade,epicoId,responsavelId,who,what,for,acceptanceCriteria,technicalTasks
US-01 [Frontend] - Cadastro de Candidatos,Backlog,User Story,Alta,Frontend,,,administrativo,cadastrar pessoas com deficiência na lista de espera,organizar e gerenciar a lista de espera,"Deve permitir inserir nome completo da pessoa com deficiência|Deve permitir inserir nome completo do responsável|Deve permitir selecionar tipo de deficiência|Deve permitir upload de laudo médico|Deve permitir upload de comprovante de residência|Deve permitir inserir telefone de contato|Deve permitir selecionar origem do encaminhamento|Deve registrar data de cadastro automaticamente","Criar interface do formulário de cadastro|Implementar validação dos campos|Integrar com backend para salvar dados|Implementar upload de arquivos"
US-02 [Frontend] - Controle de Posição na Lista,Backlog,User Story,Alta,Frontend,,,administrativo,visualizar a posição na fila de espera,acompanhar o andamento da lista,"Sistema deve manter ordem cronológica|Deve exibir a posição atual do candidato na lista","Desenvolver interface para exibir lista de espera com posições|Implementar lógica de ordenação cronológica no backend|Criar endpoint para retornar posição do candidato"
US-03 [Backend] - Gestão de Vagas Disponíveis,Backlog,User Story,Alta,Backend,,,administrativo,controlar o número de vagas disponíveis,notificar quando houver abertura,"Sistema deve controlar vagas disponíveis|Deve notificar automaticamente sobre abertura de vagas","Implementar lógica de contagem de vagas|Criar sistema de notificações|Desenvolver endpoint para consulta de vagas"
US-04 [Frontend] - Agendamento de Visita Domiciliar,Backlog,User Story,Alta,Frontend,,,equipe técnica,agendar visitas domiciliares,avaliação de perfil,"Deve permitir selecionar data e hora|Deve permitir escolher profissionais responsáveis|Deve permitir definir status da visita","Criar interface de agendamento|Implementar calendário para visualização|Integrar com backend para salvar agendamentos"
US-05 [Frontend] - Registro de Escuta Ativa e Qualificada,Backlog,User Story,Média,Frontend,,,equipe técnica,registrar informações coletadas durante a escuta,documentar dinâmica familiar e necessidades,"Deve permitir registrar dinâmica familiar|Deve permitir registrar necessidades imediatas|Deve permitir registrar habilidades identificadas|Deve permitir registrar potencialidades|Deve registrar data e profissional responsável","Criar formulário para registro de escuta|Implementar campos de texto para observações|Integrar com backend para armazenamento"
US-06 [Frontend] - Gestão do PIA,Backlog,User Story,Alta,Frontend,,,equipe técnica,"criar, editar e gerenciar PIAs",planejamento de atendimento individual e familiar,"Deve permitir criar novo PIA|Deve permitir editar PIA existente|Deve permitir apresentar PIA para família|Deve permitir apresentar PIA para equipe|Deve controlar status do PIA","Desenvolver interface de criação e edição de PIA|Implementar fluxo de aprovação|Criar funcionalidade de apresentação para família e equipe"
US-07 [Frontend] - Cadastro de Usuários,Backlog,User Story,Alta,Frontend,,,administrativo,cadastrar usuários inseridos no serviço,gerenciar informações dos usuários,"Deve permitir inserir dados pessoais completos|Deve permitir selecionar gênero e faixa etária|Deve permitir selecionar tipo de deficiência|Deve permitir registrar crença religiosa|Deve permitir inserir bairro de moradia|Deve permitir selecionar turno de atendimento|Deve permitir associar cuidador familiar|Deve registrar data de inserção","Criar formulário de cadastro de usuários|Implementar validações de dados|Integrar com backend para persistência"
US-08 [Backend] - Controle de Desligamentos,Backlog,User Story,Média,Backend,,,equipe técnica,registrar desligamentos de usuários,monitorar motivos de saída,"Deve permitir registrar motivo do desligamento (Evasão, mudança, solicitação da família, alcance de objetivos, outros)","Implementar tabela de motivos de desligamento|Criar endpoint para registro de desligamentos|Desenvolver lógica de atualização de status"
US-09 [Frontend] - Registro de Violações de Direitos,Backlog,User Story,Alta,Frontend,,,equipe técnica,categorizar e registrar violações identificadas,documentar casos para intervenção,"Deve permitir selecionar tipo de violação (Exploração de imagem, Isolamento social, Confinamento, etc.)|Deve permitir registrar detalhes da violação","Criar interface para registro de violações|Implementar lista de tipos de violação|Integrar com backend para armazenamento"
US-10 [Frontend] - Registro de Atividades,Backlog,User Story,Média,Frontend,,,equipe técnica,registrar diferentes tipos de atividades,documentar ações realizadas,"Deve permitir registrar atividades com famílias|Deve permitir registrar atividades com usuários|Deve permitir registrar atividades envolvendo usuários e famílias|Deve permitir registrar atendimentos multiprofissionais|Deve permitir registrar atendimentos técnicos individualizados|Deve permitir registrar estudos de caso","Criar formulário para registro de actividades|Implementar seleção de tipo de actividade|Integrar com backend para salvar registros"
US-11 [Frontend] - Controle de Contatos e Comunicações,Backlog,User Story,Média,Frontend,,,administrativo,registrar comunicações diversas,gerenciar interações com famílias e instituições,"Deve permitir registrar contatos telefônicos com cuidadores|Deve permitir registrar contatos telefônicos institucionais|Deve permitir registrar atendimento a público não acompanhado|Deve permitir registrar expedição/recebimento de ofícios e declarações|Deve permitir registrar encaminhamentos enviados/recebidos","Criar interface para registro de comunicações|Implementar campos para detalhamento|Integrar com backend para armazenamento"
US-12 [Frontend] - Registro de Reuniões e Eventos,Backlog,User Story,Baixa,Frontend,,,coordenador,registrar atividades institucionais,documentar eventos e reuniões,"Deve permitir registrar reuniões entre coordenação e equipe|Deve permitir registrar formações multiprofissionais|Deve permitir registrar reuniões com direção geral|Deve permitir registrar monitoramento do órgão gestor|Deve permitir registrar visitas institucionais|Deve permitir registrar eventos realizados/participados|Deve permitir registrar reuniões com parceiros","Criar formulário para registro de eventos|Implementar seleção de tipo de evento|Integrar com backend para salvar dados"
US-13 [Backend] - Gestão de Parcerias,Backlog,User Story,Baixa,Backend,,,coordenador,controlar articulação e fortalecimento de parcerias,manter registro de colaborações,"Deve permitir registrar informações de parcerias|Deve permitir atualizar status das parcerias","Implementar CRUD para entidade de parcerias|Criar endpoints para gerenciamento de parcerias"
US-14 [Backend] - Controle de Colaboradores,Backlog,User Story,Baixa,Backend,,,coordenador,registrar contratações e desligamentos de colaboradores,gerenciar equipe,"Deve permitir registrar dados de colaboradores|Deve permitir registrar data de contratação e desligamento","Implementar entidade para colaboradores|Criar endpoints para registro de contratações e desligamentos"
US-15 [Backend] - Gestão de Doações,Backlog,User Story,Baixa,Backend,,,administrativo,registrar doações realizadas e recebidas,controlar entrada e saída de recursos,"Deve permitir registrar itens doados|Deve permitir registrar data e valor da doação","Implementar CRUD para doações|Criar endpoints para gerenciamento de doações"
US-16 [Backend] - Relatórios Estatísticos,Backlog,User Story,Média,Backend,,,coordenador,gerar relatórios com dados quantitativos,análise de dados e tomada de decisão,"Deve gerar relatório mensal|Deve gerar relatório quadrimestral|Deve gerar relatório anual|Deve gerar relatório de intervenção|Deve gerar relatório de transparência","Implementar agregação de dados para relatórios|Criar endpoints para geração de relatórios|Desenvolver templates para exportação"
US-17 [Frontend] - Dashboards Analíticos,Backlog,User Story,Média,Frontend,,,coordenador,visualizar indicadores em tempo real,monitoramento contínuo do serviço,"Deve exibir usuários por tipo de deficiência|Deve exibir usuários por gênero e faixa etária|Deve exibir usuários por turno de atendimento|Deve exibir violações de direitos por categoria|Deve exibir atividades realizadas por período|Deve exibir taxa de desligamento por motivo","Desenvolver interface de dashboard com gráficos|Implementar consumo de APIs para dados em tempo real|Criar componentes visuais para indicadores"
TSK-18 [Frontend] - Garantir Interface Intuitiva,Backlog,Task,Média,Frontend,,,,,,,"Implementar design system consistente|Otimizar navegação entre páginas|Realizar testes de usabilidade"
TSK-19 [Frontend] - Implementar Design Responsivo,Backlog,Task,Média,Frontend,,,,,,,"Garantir compatibilidade com diferentes navegadores|Adaptar interface para dispositivos móveis|Testar responsividade em múltiplos tamanhos de tela"
TSK-20 [Backend] - Otimizar Performance,Backlog,Task,Alta,Backend,,,,,,,"Garantir tempo de resposta máximo de 3 segundos|Otimizar consultas ao banco de dados|Implementar cache onde necessário"
TSK-21 [Backend] - Suporte a Múltiplos Usuários,Backlog,Task,Alta,Backend,,,,,,,"Testar carga com usuários simultâneos|Otimizar concorrência de transações|Escalar recursos conforme necessidade"
TSK-22 [Backend] - Implementar Controle de Acesso,Backlog,Task,Alta,Backend,,,,,,,"Criar sistema de perfis de usuário|Implementar autenticação e autorização|Restringir acesso baseado em perfil"
TSK-23 [Backend] - Criptografar Dados Sensíveis,Backlog,Task,Alta,Backend,,,,,,,"Implementar criptografia para dados pessoais|Gerenciar chaves de criptografia|Garantir conformidade com LGPD"
TSK-24 [Backend] - Implementar Log de Auditoria,Backlog,Task,Média,Backend,,,,,,,"Registrar operações críticas do sistema|Armazenar logs de forma segura|Permitir consulta de logs para auditoria"
TSK-25 [Backend] - Configurar Backup Automático,Backlog,Task,Alta,Backend,,,,,,,"Implementar backups diários|Garantir recuperação de desastres|Testar procedimentos de restore"
TSK-26 [DevOps] - Garantir Disponibilidade 24/7,Backlog,Task,Alta,DevOps,,,,,,,"Configurar infraestrutura de alta disponibilidade|Monitorar uptime do sistema|Implementar balanceamento de carga"